Date,Versus,Ground,How Dismissed,Runs,B/F,S/R,Aggr,Avg
23/12/2004,Bangladesh,MA Aziz Stadium,run out,0,1,0,0.0,0.0
26/12/2004,Bangladesh,Bangabandhu National Stadium,c Habibul Bashar b Mashrafe Mortaza,12,11,109.09,12.0,6.0
27/12/2004,Bangladesh,Bangabandhu National Stadium,not out,7,2,350,19.0,9.5
2005-02-04 00:00:00,Pakistan,Nehru Stadium (Kochi),c Naved-ul-Hasan b Arshad Khan,3,7,42.86,22.0,7.33
2005-05-04 00:00:00,Pakistan,Dr YS Rajasekhara Reddy Cricket Stadium,c Shoaib Malik b Mohammad Hafeez,148,123,120.33,170.0,42.5
2005-09-04 00:00:00,Pakistan,Keenan Stadium,c †Kamran Akmal b Naved-ul-Hasan,28,24,116.67,198.0,39.6
2005-12-04 00:00:00,Pakistan,Sardar Patel Stadium,c †Kamran Akmal b Shoaib Malik,47,64,73.44,245.0,40.83
15/04/2005,Pakistan,Green Park,c Younis Khan b Naved-ul-Hasan,11,16,68.75,256.0,36.57
17/04/2005,Pakistan,Arun Jaitley Stadium,c Shahid Afridi b Arshad Khan,24,38,63.16,280.0,35.0
30/07/2005,Sri Lanka,Rangiri Dambulla International Stadium,b L H D Dilhara,2,7,28.57,282.0,31.33
31/07/2005,West Indies,Rangiri Dambulla International Stadium,not out,15,11,136.36,297.0,33.0
2005-03-08 00:00:00,Sri Lanka,Rangiri Dambulla International Stadium,c & b T M Dilshan,20,27,74.07,317.0,31.7
2005-07-08 00:00:00,West Indies,R Premadasa Stadium,not out,28,13,215.38,345.0,34.5
2005-09-08 00:00:00,Sri Lanka,R Premadasa Stadium,lbw b U D U Chandana,7,11,63.64,352.0,32.0
26/08/2005,New Zealand,Queens Sports Club,c †B B McCullum b A R Adams,2,5,40,354.0,29.5
29/08/2005,Zimbabwe,Harare Sports Club,c N B Mahwire b A J Ireland,56,46,121.74,410.0,31.54
2005-02-09 00:00:00,New Zealand,Harare Sports Club,not out,37,27,137.04,447.0,34.38
2005-04-09 00:00:00,Zimbabwe,Harare Sports Club,not out,67,63,106.35,514.0,39.54
2005-06-09 00:00:00,New Zealand,Harare Sports Club,lbw b S B Styris,11,16,68.75,525.0,37.5
25/10/2005,Sri Lanka,Vidarbha Cricket Association Ground,c D P M D Jayawardene b C R D Fernando,38,28,135.71,563.0,37.53
28/10/2005,Sri Lanka,Punjab Cricket Association IS Bindra Stadium,did not bat,-,-,-,563.0,37.53
31/10/2005,Sri Lanka,Sawai Mansingh Stadium,not out,183,145,126.21,746.0,49.73
2005-03-11 00:00:00,Sri Lanka,Nehru Stadium (Pune),not out,45,43,104.65,791.0,52.73
2005-06-11 00:00:00,Sri Lanka,Sardar Patel Stadium,lbw b D N T Zoysa,0,1,0,791.0,49.44
2005-09-11 00:00:00,Sri Lanka,Madhavrao Scindia Cricket Ground,did not bat,-,-,-,791.0,49.44
2005-12-11 00:00:00,Sri Lanka,Reliance Stadium,c sub b U D U Chandana,80,73,109.59,871.0,51.24
16/11/2005,South Africa,Rajiv Gandhi International Stadium,run out,17,28,60.71,888.0,49.33
19/11/2005,South Africa,M Chinnaswamy Stadium,did not bat,-,-,-,888.0,49.33
25/11/2005,South Africa,Eden Gardens,c J Botha b A J Hall,14,26,53.85,902.0,47.47
28/11/2005,South Africa,Wankhede Stadium,c †M V Boucher b C K Langeveldt,12,26,46.15,914.0,45.7
2006-06-02 00:00:00,Pakistan,Arbab Niaz Stadium,c Shoaib Malik b Mohammad Asif,68,53,128.3,982.0,46.76
2006-11-02 00:00:00,Pakistan,Rawalpindi Cricket Stadium,did not bat,-,-,-,982.0,46.76
13/02/2006,Pakistan,Gaddafi Stadium,not out,72,46,156.52,1054.0,50.19
16/02/2006,Pakistan,Multan Cricket Stadium,not out,2,5,40,1056.0,50.29
19/02/2006,Pakistan,National Stadium (Karachi),not out,77,56,137.5,1133.0,53.95
28/03/2006,England,Arun Jaitley Stadium,c P D Collingwood b L E Plunkett,20,28,71.43,1153.0,52.41
31/03/2006,England,Nahar Singh Stadium,b A Flintoff,38,55,69.09,1191.0,51.78
2006-03-04 00:00:00,England,Nehru Stadium (Margao),not out,13,6,216.67,1204.0,52.35
2006-06-04 00:00:00,England,Nehru Stadium (Kochi),not out,10,13,76.92,1214.0,52.78
2006-12-04 00:00:00,England,Keenan Stadium,c V S Solanki b S I Mahmood,96,106,90.57,1310.0,54.58
18/04/2006,Pakistan,Sheikh Zayed Stadium,b Shoaib Malik,3,10,30,1313.0,52.52
19/04/2006,Pakistan,Sheikh Zayed Stadium,b Naved-ul-Hasan,59,72,81.94,1372.0,52.77
18/05/2006,West Indies,Sabina Park,c R S Morton b D J J Bravo,18,11,163.64,1390.0,51.48
20/05/2006,West Indies,Sabina Park,b J E Taylor,2,7,28.57,1392.0,49.71
23/05/2006,West Indies,Warner Park,run out,15,26,57.69,1407.0,48.52
26/05/2006,West Indies,Queen's Park Oval,not out,46,58,79.31,1453.0,50.1
28/05/2006,West Indies,Queen's Park Oval,b W W Hinds,14,19,73.68,1467.0,48.9
18/08/2006,Sri Lanka,Sinhalese Sports Club Ground,did not bat,-,-,-,1467.0,48.9
14/09/2006,West Indies,Kinrara Academy Oval,b J E Taylor,2,10,20,1469.0,47.39
16/09/2006,Australia,Kinrara Academy Oval,did not bat,-,-,-,1469.0,47.39
20/09/2006,West Indies,Kinrara Academy Oval,b C D Collymore,18,13,138.46,1487.0,46.47
22/09/2006,Australia,Kinrara Academy Oval,c D R Martyn b B Lee,23,34,67.65,1510.0,45.76
15/10/2006,England,Sawai Mansingh Stadium,c P D Collingwood b J W M Dalrymple,7,22,31.82,1517.0,44.62
26/10/2006,West Indies,Sardar Patel Stadium,run out,51,65,78.46,1568.0,44.8
29/10/2006,Australia,Punjab Cricket Association IS Bindra Stadium,lbw b N W Bracken,28,23,121.74,1596.0,44.33
22/11/2006,South Africa,Kingsmead,c †M V Boucher b A Nel,14,27,51.85,1610.0,43.51
26/11/2006,South Africa,Newlands,c L L Bosman b J H Kallis,55,48,114.58,1665.0,43.82
29/11/2006,South Africa,St George's Park,c sub b A Nel,26,21,123.81,1691.0,43.36
2006-03-12 00:00:00,South Africa,SuperSport Park,c A Nel b M Ntini,44,49,89.8,1735.0,43.38
21/01/2007,West Indies,Vidarbha Cricket Association Ground,not out,62,42,147.62,1797.0,44.93
24/01/2007,West Indies,Barabati Stadium,c & b D R Smith,6,19,31.58,1803.0,43.98
31/01/2007,West Indies,Reliance Stadium,not out,40,20,200,1843.0,44.95
2007-08-02 00:00:00,Sri Lanka,Eden Gardens,did not bat,-,-,-,1843.0,44.95
2007-11-02 00:00:00,Sri Lanka,Madhavrao Scindia Cricket Ground,c M F Maharoof b S T Jayasuriya,48,68,70.59,1891.0,45.02
14/02/2007,Sri Lanka,Nehru Stadium (Margao),not out,67,74,90.54,1958.0,46.62
17/02/2007,Sri Lanka,Dr YS Rajasekhara Reddy Cricket Stadium,did not bat,-,-,-,1958.0,46.62
17/03/2007,Bangladesh,Queen's Park Oval,c Aftab Ahmed b Mohammad Rafique,0,3,0,1958.0,45.53
19/03/2007,Bermuda,Queen's Park Oval,c J J Tucker b D C Borden,29,25,116,1987.0,45.16
23/03/2007,Sri Lanka,Queen's Park Oval,lbw b M Muralitharan,0,1,0,1987.0,44.16
2007-10-05 00:00:00,Bangladesh,Shere Bangla National Stadium,not out,91,106,85.85,2078.0,46.18
2007-12-05 00:00:00,Bangladesh,Shere Bangla National Stadium,c †Mushfiqur Rahim b Mohammad Rafique,36,54,66.67,2114.0,45.96
2007-06-06 00:00:00,ACA Africa XI,M Chinnaswamy Stadium,run out,2,4,50,2116.0,45.02
2007-09-06 00:00:00,ACA Africa XI,MA Chidambaram Stadium,b J A Morkel,33,38,86.84,2149.0,44.77
2007-10-06 00:00:00,ACA Africa XI,MA Chidambaram Stadium,not out,139,97,143.3,2288.0,47.67
29/06/2007,South Africa,Civil Service Cricket Club,b M Ntini,0,4,0,2288.0,46.69
2007-01-07 00:00:00,South Africa,Civil Service Cricket Club,not out,14,11,127.27,2302.0,46.98
16/08/2007,Scotland,Titwood,did not bat,-,-,-,2302.0,46.98
21/08/2007,England,The Rose Bowl,c †M J Prior b A Flintoff,19,60,31.67,2321.0,46.42
24/08/2007,England,County Ground (Bristol),c C T Tremlett b J M Anderson,21,18,116.67,2342.0,45.92
27/08/2007,England,Edgbaston,c P D Collingwood b J M Anderson,13,20,65,2355.0,45.29
30/08/2007,England,Old Trafford,b M S Panesar,13,18,72.22,2368.0,44.68
2007-02-09 00:00:00,England,Headingley,c †M J Prior b J M Anderson,24,17,141.18,2392.0,44.3
2007-05-09 00:00:00,England,Kennington Oval,b S C J Broad,35,37,94.59,2427.0,44.13
2007-08-09 00:00:00,England,Lord's,c J M Anderson b A Flintoff,50,72,69.44,2477.0,44.23
29/09/2007,Australia,M Chinnaswamy Stadium,did not bat,-,-,-,2477.0,44.23
2007-02-10 00:00:00,Australia,Nehru Stadium (Kochi),c B J Hodge b G B Hogg,58,88,65.91,2535.0,44.47
2007-05-10 00:00:00,Australia,Rajiv Gandhi International Stadium,c †A C Gilchrist b B Lee,33,37,89.19,2568.0,44.28
2007-08-10 00:00:00,Australia,Sector 16 Stadium,not out,50,35,142.86,2618.0,45.14
2007-11-10 00:00:00,Australia,Reliance Stadium,c †A C Gilchrist b M G Johnson,4,7,57.14,2622.0,44.44
14/10/2007,Australia,Vidarbha Cricket Association Ground,c R T Ponting b M G Johnson,26,29,89.66,2648.0,44.13
17/10/2007,Australia,Wankhede Stadium,c †A C Gilchrist b N W Bracken,5,11,45.45,2653.0,43.49
2007-05-11 00:00:00,Pakistan,Nehru Stadium (Guwahati),c †Kamran Akmal b Shoaib Akhtar,63,77,81.82,2716.0,43.81
2007-08-11 00:00:00,Pakistan,Punjab Cricket Association IS Bindra Stadium,c †Kamran Akmal b Shoaib Akhtar,4,10,40,2720.0,43.17
2007-11-11 00:00:00,Pakistan,Green Park,b Shoaib Akhtar,49,52,94.23,2769.0,43.27
15/11/2007,Pakistan,Captain Roop Singh Stadium,not out,45,45,100,2814.0,43.97
18/11/2007,Pakistan,Sawai Mansingh Stadium,c Imran Nazir b Shoaib Malik,24,32,75,2838.0,43.66
2008-03-02 00:00:00,Australia,Brisbane Cricket Ground,c R T Ponting b B Lee,37,61,60.66,2875.0,43.56
2008-04-02 00:00:00,Sri Lanka,Brisbane Cricket Ground,not out,88,95,92.63,2963.0,44.89
2008-10-02 00:00:00,Australia,Melbourne Cricket Ground,not out,17,54,31.48,2980.0,45.15
2008-12-02 00:00:00,Sri Lanka,Manuka Oval,run out,31,26,119.23,3011.0,44.94
17/02/2008,Australia,Adelaide Oval,run out,37,50,74,3048.0,44.82
19/02/2008,Sri Lanka,Adelaide Oval,not out,50,68,73.53,3098.0,45.56
24/02/2008,Australia,Sydney Cricket Ground,c †A C Gilchrist b B Lee,36,66,54.55,3134.0,45.42
26/02/2008,Sri Lanka,Bellerive Oval,did not bat,-,-,-,3134.0,45.42
2008-02-03 00:00:00,Australia,Sydney Cricket Ground,not out,15,12,125,3149.0,45.64
2008-04-03 00:00:00,Australia,Brisbane Cricket Ground,c M J Clarke b N W Bracken,36,37,97.3,3185.0,45.5
2008-10-06 00:00:00,Pakistan,Shere Bangla National Stadium,lbw b Sohail Tanvir,24,23,104.35,3209.0,45.2
2008-12-06 00:00:00,Bangladesh,Shere Bangla National Stadium,did not bat,-,-,-,3209.0,45.2
14/06/2008,Pakistan,Shere Bangla National Stadium,c sub b Shahid Afridi,64,59,108.47,3273.0,45.46
25/06/2008,Hong Kong,National Stadium (Karachi),not out,109,96,113.54,3382.0,46.97
26/06/2008,Pakistan,National Stadium (Karachi),not out,26,30,86.67,3408.0,47.33
28/06/2008,Bangladesh,National Stadium (Karachi),did not bat,-,-,-,3408.0,47.33
2008-02-07 00:00:00,Pakistan,National Stadium (Karachi),c †Sarfaraz Ahmed b Sohail Tanvir,76,96,79.17,3484.0,47.73
2008-03-07 00:00:00,Sri Lanka,National Stadium (Karachi),b M Muralitharan,67,62,108.06,3551.0,47.99
2008-06-07 00:00:00,Sri Lanka,National Stadium (Karachi),c †K C Sangakkara b W P U J C Vaas,49,74,66.22,3600.0,48.0
18/08/2008,Sri Lanka,Rangiri Dambulla International Stadium,c D P M D Jayawardene b B A W Mendis,6,28,21.43,3606.0,47.45
20/08/2008,Sri Lanka,Rangiri Dambulla International Stadium,b C R D Fernando,39,54,72.22,3645.0,47.34
24/08/2008,Sri Lanka,R Premadasa Stadium,c D P M D Jayawardene b B A W Mendis,76,80,95,3721.0,47.71
27/08/2008,Sri Lanka,R Premadasa Stadium,c S T Jayasuriya b T Thushara,71,80,88.75,3792.0,48.0
29/08/2008,Sri Lanka,R Premadasa Stadium,b C R D Fernando,1,7,14.29,3793.0,47.41
14/11/2008,England,Madhavrao Scindia Cricket Ground,b S J Harmison,39,32,121.88,3832.0,47.31
17/11/2008,England,Holkar Cricket Stadium,b P D Collingwood,15,26,57.69,3847.0,46.91
20/11/2008,England,Green Park,not out,29,51,56.86,3876.0,47.27
23/11/2008,England,M Chinnaswamy Stadium,b S R Patel,9,5,180,3885.0,46.81
26/11/2008,England,Barabati Stadium,lbw b G P Swann,50,61,81.97,3935.0,46.85
28/01/2009,Sri Lanka,Rangiri Dambulla International Stadium,not out,61,65,93.85,3996.0,47.57
31/01/2009,Sri Lanka,R Premadasa Stadium,c †K C Sangakkara b M F Maharoof,23,35,65.71,4019.0,47.28
2009-03-02 00:00:00,Sri Lanka,R Premadasa Stadium,not out,35,45,77.78,4054.0,47.69
2009-05-02 00:00:00,Sri Lanka,R Premadasa Stadium,c C R D Fernando b S T Jayasuriya,94,96,97.92,4148.0,48.23
2009-08-02 00:00:00,Sri Lanka,R Premadasa Stadium,c K M D N Kulasekara b S T Jayasuriya,53,58,91.38,4201.0,48.29
2009-03-03 00:00:00,New Zealand,McLean Park,not out,84,89,94.38,4285.0,49.25
2009-06-03 00:00:00,New Zealand,Westpac Stadium,not out,23,19,121.05,4308.0,49.52
2009-08-03 00:00:00,New Zealand,AMI Stadium,c †P D McGlashan b K D Mills,68,58,117.24,4376.0,49.73
2009-11-03 00:00:00,New Zealand,Seddon Park,did not bat,-,-,-,4376.0,49.73
14/03/2009,New Zealand,Eden Park,b J D Ryder,9,21,42.86,4385.0,49.27
26/06/2009,West Indies,Sabina Park,run out,41,46,89.13,4426.0,49.18
28/06/2009,West Indies,Sabina Park,b J E Taylor,95,130,73.08,4521.0,49.68
2009-03-07 00:00:00,West Indies,Darren Sammy National Cricket Stadium,not out,46,34,135.29,4567.0,50.19
2009-05-07 00:00:00,West Indies,Darren Sammy National Cricket Stadium,did not bat,-,-,-,4567.0,50.19
2009-11-09 00:00:00,New Zealand,R Premadasa Stadium,not out,35,65,53.85,4602.0,50.57
2009-12-09 00:00:00,Sri Lanka,R Premadasa Stadium,b A D Mathews,8,18,44.44,4610.0,50.11
14/09/2009,Sri Lanka,R Premadasa Stadium,c S H T Kandamby b S L Malinga,56,62,90.32,4666.0,50.17
26/09/2009,Pakistan,SuperSport Park,lbw b Shahid Afridi,3,9,33.33,4669.0,49.67
28/09/2009,Australia,SuperSport Park,did not bat,-,-,-,4669.0,49.67
30/09/2009,West Indies,Wanderers Stadium,did not bat,-,-,-,4669.0,49.67
25/10/2009,Australia,Reliance Stadium,c B Lee b S R Watson,34,46,73.91,4703.0,49.51
28/10/2009,Australia,Vidarbha Cricket Association Stadium,c †T D Paine b M G Johnson,124,107,115.89,4827.0,50.28
31/10/2009,Australia,Arun Jaitley Stadium,not out,71,95,74.74,4898.0,51.02
2009-02-11 00:00:00,Australia,Punjab Cricket Association IS Bindra Stadium,c †G A Manou b D E Bollinger,26,46,56.52,4924.0,50.76
2009-05-11 00:00:00,Australia,Rajiv Gandhi International Stadium,c A C Voges b C J McKay,6,15,40,4930.0,50.31
2009-08-11 00:00:00,Australia,Nehru Stadium (Guwahati),lbw b D E Bollinger,24,77,31.17,4954.0,50.04
15/12/2009,Sri Lanka,Madhavrao Scindia Cricket Ground,c A D Mathews b C R D Fernando,72,53,135.85,5026.0,50.26
18/12/2009,Sri Lanka,Vidarbha Cricket Association Stadium,c T M Dilshan b S Randiv,107,111,96.4,5133.0,50.82
27/12/2009,Sri Lanka,Arun Jaitley Stadium,did not bat,-,-,-,5133.0,50.82
2010-05-01 00:00:00,Sri Lanka,Shere Bangla National Stadium,c †K C Sangakkara b N L T C Perera,37,70,52.86,5170.0,50.69
2010-07-01 00:00:00,Bangladesh,Shere Bangla National Stadium,not out,101,107,94.39,5271.0,51.68
2010-10-01 00:00:00,Sri Lanka,Shere Bangla National Stadium,did not bat,-,-,-,5271.0,51.68
2010-11-01 00:00:00,Bangladesh,Shere Bangla National Stadium,c Imrul Kayes b Shakib Al Hasan,32,35,91.43,5303.0,51.49
13/01/2010,Sri Lanka,Shere Bangla National Stadium,c †K C Sangakkara b K M D N Kulasekara,14,19,73.68,5317.0,51.13
21/02/2010,South Africa,Sawai Mansingh Stadium,c J A Morkel b J H Kallis,26,29,89.66,5343.0,50.89
24/02/2010,South Africa,Captain Roop Singh Stadium,not out,68,35,194.29,5411.0,51.53
27/02/2010,South Africa,Sardar Patel Stadium,c †M V Boucher b D W Steyn,9,7,128.57,5420.0,51.13
16/06/2010,Bangladesh,Rangiri Dambulla International Stadium,not out,38,45,84.44,5458.0,51.49
19/06/2010,Pakistan,Rangiri Dambulla International Stadium,b Shoaib Malik,56,71,78.87,5514.0,51.53
22/06/2010,Sri Lanka,Rangiri Dambulla International Stadium,run out,41,53,77.36,5555.0,51.44
24/06/2010,Sri Lanka,Rangiri Dambulla International Stadium,c K M D N Kulasekara b S H T Kandamby,38,50,76,5593.0,51.31
2010-10-08 00:00:00,New Zealand,Rangiri Dambulla International Stadium,run out,2,9,22.22,5595.0,50.86
16/08/2010,Sri Lanka,Rangiri Dambulla International Stadium,not out,23,38,60.53,5618.0,51.07
21/08/2010,Sri Lanka,Rangiri Dambulla International Stadium,c †K C Sangakkara b N L T C Perera,10,16,62.5,5628.0,50.7
25/08/2010,New Zealand,Rangiri Dambulla International Stadium,c †G J Hopkins b N L McCullum,38,75,50.67,5666.0,50.59
28/08/2010,Sri Lanka,Rangiri Dambulla International Stadium,b S Randiv,67,100,67,5733.0,50.73
20/10/2010,Australia,Dr YS Rajasekhara Reddy Cricket Stadium,b J W Hastings,0,1,0,5733.0,50.29
2011-12-01 00:00:00,South Africa,Kingsmead,run out,25,35,71.43,5758.0,50.07
15/01/2011,South Africa,Wanderers Stadium,b L L Tsotsobe,38,61,62.3,5796.0,49.97
18/01/2011,South Africa,Newlands,c †A B de Villiers b J Botha,5,12,41.67,5801.0,49.58
21/01/2011,South Africa,St George's Park,c F du Plessis b R J Peterson,2,8,25,5803.0,49.18
23/01/2011,South Africa,SuperSport Park,c G C Smith b M Morkel,5,10,50,5808.0,48.81
19/02/2011,Bangladesh,Shere Bangla National Stadium,did not bat,-,-,-,5808.0,48.81
27/02/2011,England,M Chinnaswamy Stadium,c sub b T T Bresnan,31,25,124,5839.0,48.66
2011-06-03 00:00:00,Ireland,M Chinnaswamy Stadium,lbw b G H Dockrell,34,50,68,5873.0,48.54
2011-09-03 00:00:00,Netherlands,Arun Jaitley Stadium,not out,19,40,47.5,5892.0,48.69
2011-12-03 00:00:00,South Africa,Vidarbha Cricket Association Stadium,not out,12,21,57.14,5904.0,48.79
20/03/2011,West Indies,MA Chidambaram Stadium,st D C Thomas b D Bishoo,22,30,73.33,5926.0,48.57
24/03/2011,Australia,Sardar Patel Stadium,c M J Clarke b B Lee,7,8,87.5,5933.0,48.24
30/03/2011,Pakistan,Punjab Cricket Association IS Bindra Stadium,lbw b Wahab Riaz,25,42,59.52,5958.0,48.05
2011-02-04 00:00:00,Sri Lanka,Wankhede Stadium,not out,91,79,115.19,6049.0,48.78
2011-03-09 00:00:00,England,Riverside Ground,c †C Kieswetter b T T Bresnan,33,36,91.67,6082.0,48.66
2011-06-09 00:00:00,England,The Rose Bowl,c I R Bell b T T Bresnan,6,5,120,6088.0,48.32
2011-09-09 00:00:00,England,Kennington Oval,c A N Cook b T T Bresnan,69,103,66.99,6157.0,48.48
2011-11-09 00:00:00,England,Lord's,not out,78,71,109.86,6235.0,49.09
16/09/2011,England,Sophia Gardens,not out,50,26,192.31,6285.0,49.49
14/10/2011,England,Rajiv Gandhi International Stadium,not out,87,70,124.29,6372.0,50.17
17/10/2011,England,Arun Jaitley Stadium,did not bat,-,-,-,6372.0,50.17
20/10/2011,England,Punjab Cricket Association IS Bindra Stadium,not out,35,31,112.9,6407.0,50.45
23/10/2011,England,Wankhede Stadium,not out,15,18,83.33,6422.0,50.57
25/10/2011,England,Eden Gardens,not out,75,69,108.7,6497.0,51.16
2012-05-02 00:00:00,Australia,Melbourne Cricket Ground,c D A Warner b X J Doherty,29,38,76.32,6526.0,50.98
2012-08-02 00:00:00,Sri Lanka,WACA Ground,c S L Malinga b K T G D Prasad,4,5,80,6530.0,50.62
2012-12-02 00:00:00,Australia,Adelaide Oval,not out,44,58,75.86,6574.0,50.96
14/02/2012,Sri Lanka,Adelaide Oval,not out,58,69,84.06,6632.0,51.41
19/02/2012,Australia,Brisbane Cricket Ground,c D T Christian b B W Hilfenhaus,56,84,66.67,6688.0,51.45
26/02/2012,Australia,Sydney Cricket Ground,lbw b B W Hilfenhaus,14,49,28.57,6702.0,51.16
28/02/2012,Sri Lanka,Bellerive Oval,did not bat,-,-,-,6702.0,51.16
13/03/2012,Sri Lanka,Shere Bangla National Stadium,not out,46,26,176.92,6748.0,51.51
16/03/2012,Bangladesh,Shere Bangla National Stadium,not out,21,11,190.91,6769.0,51.67
18/03/2012,Pakistan,Shere Bangla National Stadium,not out,4,1,400,6773.0,51.7
21/07/2012,Sri Lanka,Mahinda Rajapaksha International Cricket Stadium,c H D R L Thirimanne b N L T C Perera,35,29,120.69,6808.0,51.58
24/07/2012,Sri Lanka,Mahinda Rajapaksha International Cricket Stadium,c †K C Sangakkara b A D Mathews,11,16,68.75,6819.0,51.27
28/07/2012,Sri Lanka,R Premadasa Stadium,b S L Malinga,31,49,63.27,6850.0,51.12
31/07/2012,Sri Lanka,R Premadasa Stadium,did not bat,-,-,-,6850.0,51.12
2012-04-08 00:00:00,Sri Lanka,Pallekele International Cricket Stadium,c †L D Chandimal b S L Malinga,58,38,152.63,6908.0,51.17
30/12/2012,Pakistan,MA Chidambaram Stadium,not out,113,125,90.4,7021.0,52.01
2013-03-01 00:00:00,Pakistan,Eden Gardens,not out,54,89,60.67,7075.0,52.41
2013-06-01 00:00:00,Pakistan,Arun Jaitley Stadium,c Umar Akmal b Umar Gul,36,55,65.45,7111.0,52.29
2013-11-01 00:00:00,England,Saurashtra Cricket Association Stadium,c J E Root b J W Dernbach,32,25,128,7143.0,52.14
15/01/2013,England,Nehru Stadium (Kochi),c J E Root b J W Dernbach,72,66,109.09,7215.0,52.28
19/01/2013,England,JSCA International Stadium Complex,not out,10,12,83.33,7225.0,52.36
23/01/2013,England,Punjab Cricket Association IS Bindra Stadium,c E J G Morgan b J W Dernbach,19,21,90.48,7244.0,52.12
27/01/2013,England,Himachal Pradesh Cricket Association Stadium,lbw b S T Finn,15,23,65.22,7259.0,51.85
2013-06-06 00:00:00,South Africa,Sophia Gardens,c F du Plessis b L L Tsotsobe,27,26,103.85,7286.0,51.67
2013-11-06 00:00:00,West Indies,Kennington Oval,did not bat,-,-,-,7286.0,51.67
15/06/2013,Pakistan,Edgbaston,did not bat,-,-,-,7286.0,51.67
20/06/2013,Sri Lanka,Sophia Gardens,did not bat,-,-,-,7286.0,51.67
23/06/2013,England,Edgbaston,c J C Tredwell b R S Bopara,0,4,0,7286.0,51.31
30/06/2013,West Indies,Sabina Park,b T L Best,27,35,77.14,7313.0,51.14
2013-11-07 00:00:00,Sri Lanka,Queen's Park Oval,not out,45,52,86.54,7358.0,51.45
13/10/2013,Australia,Maharashtra Cricket Association Stadium,b C J McKay,19,22,86.36,7377.0,51.23
16/10/2013,Australia,Sawai Mansingh Stadium,did not bat,-,-,-,7377.0,51.23
19/10/2013,Australia,Punjab Cricket Association IS Bindra Stadium,not out,139,121,114.88,7516.0,52.19
23/10/2013,Australia,JSCA International Stadium Complex,did not bat,-,-,-,7516.0,52.19
30/10/2013,Australia,Vidarbha Cricket Association Stadium,not out,25,23,108.7,7541.0,52.37
2013-02-11 00:00:00,Australia,M Chinnaswamy Stadium,run out,62,38,163.16,7603.0,52.43
21/11/2013,West Indies,Nehru Stadium (Kochi),not out,13,7,185.71,7616.0,52.52
24/11/2013,West Indies,Dr YS Rajasekhara Reddy Cricket Stadium,not out,51,40,127.5,7667.0,52.88
27/11/2013,West Indies,Green Park,not out,23,23,100,7690.0,53.03
2013-05-12 00:00:00,South Africa,Wanderers Stadium,b D W Steyn,65,71,91.55,7755.0,53.12
2013-08-12 00:00:00,South Africa,Kingsmead,c †Q de Kock b V D Philander,19,31,61.29,7774.0,52.88
2013-11-12 00:00:00,South Africa,SuperSport Park,did not bat,-,-,-,7774.0,52.88
19/01/2014,New Zealand,McLean Park,c †L Ronchi b M J McClenaghan,40,46,86.96,7814.0,52.8
22/01/2014,New Zealand,Seddon Park,c K S Williamson b C J Anderson,56,44,127.27,7870.0,52.82
25/01/2014,New Zealand,Eden Park,c T G Southee b C J Anderson,50,60,83.33,7920.0,52.8
28/01/2014,New Zealand,Seddon Park,not out,79,73,108.22,7999.0,53.33
31/01/2014,New Zealand,Westpac Stadium,c J D S Neesham b K S Williamson,47,72,65.28,8046.0,53.28
27/08/2014,England,Sophia Gardens,b C R Woakes,52,51,101.96,8098.0,53.28
30/08/2014,England,Trent Bridge,did not bat,-,-,-,8098.0,53.28
2014-02-09 00:00:00,England,Edgbaston,did not bat,-,-,-,8098.0,53.28
2014-05-09 00:00:00,England,Headingley,c B A Stokes b S T Finn,29,42,69.05,8127.0,53.12
2014-08-10 00:00:00,West Indies,Nehru Stadium (Kochi),b D J G Sammy,8,21,38.1,8135.0,52.82
2014-11-10 00:00:00,West Indies,Arun Jaitley Stadium,not out,51,40,127.5,8186.0,53.16
17/10/2014,West Indies,Himachal Pradesh Cricket Association Stadium,run out,6,5,120,8192.0,52.85
18/01/2015,Australia,Melbourne Cricket Ground,b M A Starc,19,31,61.29,8211.0,52.63
20/01/2015,England,Brisbane Cricket Ground,c †J C Buttler b S T Finn,34,61,55.74,8245.0,52.52
26/01/2015,Australia,Sydney Cricket Ground,did not bat,-,-,-,8245.0,52.52
30/01/2015,England,WACA Ground,lbw b J M Anderson,17,32,53.13,8262.0,52.29
15/02/2015,Pakistan,Adelaide Oval,c Misbah-ul-Haq b Sohail Khan,18,13,138.46,8280.0,52.08
22/02/2015,South Africa,Melbourne Cricket Ground,c †Q de Kock b M Morkel,18,11,163.64,8298.0,51.86
28/02/2015,United Arab Emirates,WACA Ground,did not bat,-,-,-,8298.0,51.86
2015-06-03 00:00:00,West Indies,WACA Ground,not out,45,56,80.36,8343.0,52.14
2015-10-03 00:00:00,Ireland,Seddon Park,did not bat,-,-,-,8343.0,52.14
14/03/2015,Zimbabwe,Eden Park,not out,85,76,111.84,8428.0,52.68
19/03/2015,Bangladesh,Melbourne Cricket Ground,c Nasir Hossain b Taskin Ahmed,6,11,54.55,8434.0,52.39
26/03/2015,Australia,Sydney Cricket Ground,run out,65,65,100,8499.0,52.46
18/06/2015,Bangladesh,Shere Bangla National Stadium,c †Mushfiqur Rahim b Shakib Al Hasan,5,7,71.43,8504.0,52.17
21/06/2015,Bangladesh,Shere Bangla National Stadium,c Soumya Sarkar b Mustafizur Rahman,47,75,62.67,8551.0,52.14
24/06/2015,Bangladesh,Shere Bangla National Stadium,c Mustafizur Rahman b Mashrafe Mortaza,69,77,89.61,8620.0,52.24
2015-11-10 00:00:00,South Africa,Green Park,c & b K Rabada,31,30,103.33,8651.0,52.11
14/10/2015,South Africa,Holkar Cricket Stadium,not out,92,86,106.98,8743.0,52.67
18/10/2015,South Africa,Saurashtra Cricket Association Stadium,c D W Steyn b M Morkel,47,61,77.05,8790.0,52.63
22/10/2015,South Africa,MA Chidambaram Stadium,c A B de Villiers b D W Steyn,15,16,93.75,8805.0,52.41
25/10/2015,South Africa,Wankhede Stadium,b Imran Tahir,27,29,93.1,8832.0,52.26
2016-12-01 00:00:00,Australia,WACA Ground,c S M Boland b J P Faulkner,18,13,138.46,8850.0,52.06
15/01/2016,Australia,Brisbane Cricket Ground,c G J Maxwell b S M Boland,11,10,110,8861.0,51.82
17/01/2016,Australia,Melbourne Cricket Ground,c G J Maxwell b J W Hastings,23,9,255.56,8884.0,51.65
20/01/2016,Australia,Manuka Oval,c †M S Wade b J W Hastings,0,3,0,8884.0,51.35
23/01/2016,Australia,Sydney Cricket Ground,c D A Warner b M R Marsh,34,42,80.95,8918.0,51.25
2016-11-06 00:00:00,Zimbabwe,Harare Sports Club,did not bat,-,-,-,8918.0,51.25
13/06/2016,Zimbabwe,Harare Sports Club,did not bat,-,-,-,8918.0,51.25
15/06/2016,Zimbabwe,Harare Sports Club,did not bat,-,-,-,8918.0,51.25
16/10/2016,New Zealand,Himachal Pradesh Cricket Association Stadium,run out,21,24,87.5,8939.0,51.08
20/10/2016,New Zealand,Arun Jaitley Stadium,c & b T G Southee,39,65,60,8978.0,51.01
23/10/2016,New Zealand,Punjab Cricket Association IS Bindra Stadium,c L R P L Taylor b M J Henry,80,91,87.91,9058.0,51.18
26/10/2016,New Zealand,JSCA International Stadium Complex,b J D S Neesham,11,31,35.48,9069.0,50.95
29/10/2016,New Zealand,Dr YS Rajasekhara Reddy Cricket Stadium,lbw b M J Santner,41,59,69.49,9110.0,50.89
15/01/2017,England,Maharashtra Cricket Association Stadium,c D J Willey b J T Ball,6,6,100,9116.0,50.64
19/01/2017,England,Barabati Stadium,c D J Willey b L E Plunkett,134,122,109.84,9250.0,51.1
